{
  "id": "ff7_cloud",
  "name": "Cloud Strife",
  "game": "ff7",
  "role": "hero",
  "body_template": "male_heroic",
  "rig_template": "humanoid_standard",
  "animation_profile": "heavy_sword",
  "weapon": "buster_sword",
  "source_model": null,
  "height_voxels": 44,
  "palette_profile": "blond_dark_steel",
  "accent_colors": [
    "#E7C544",
    "#1E2738",
    "#7F8790"
  ],
  "export_formats": [
    "glb",
    "fbx"
  ],
  "render_profile": "character_preview",
  "render_resolution": 768
}